날짜,별점,스킨타입,태그,리뷰내용,raw_text,clean_text,quality_score,length,korean_ratio
2025.08.23,4점,,,무난합니다 하얘지진 않지만 누런끼가 줄었어요 꾸준히 바를 생각이에유,무난합니다 하얘지진 않지만 누런끼가 줄었어요 꾸준히 바를 생각이에유,무난합니다 하얘지진 않지만 누런끼가 줄었어요 꾸준히 바를 생각이에유,1.0,37,0.8108108108108109
2025.08.22,4점,,한달이상사용,"미백은 진짜 쬐에ㅔㅔ끔 효고ㅏ 있어요 그냥 안색이 밝아졌다..?
그냥 무난하게 사용하고 있어요 이거 쓰면 트러블이 안 나고 순해서 좋은 거 같아요","미백은 진짜 쬐에ㅔㅔ끔 효고ㅏ 있어요 그냥 안색이 밝아졌다..?
그냥 무난하게 사용하고 있어요 이거 쓰면 트러블이 안 나고 순해서 좋은 거 같아요",미백은 진짜 쬐에끔 효고 있어요 그냥 안색이 밝아졌다 그냥 무난하게 사용하고 있어요 이거 쓰면 트러블이 안 나고 순해서 좋은 거 같아요,1.0,75,0.7333333333333333
2025.08.20,5점,,한달이상사용,막 엄청난 효과는 아직 보지 못했어요… 꾸준히 쓰면 효과가 있겠죠..?,막 엄청난 효과는 아직 보지 못했어요… 꾸준히 쓰면 효과가 있겠죠..?,막 엄청난 효과는 아직 보지 못했어요 꾸준히 쓰면 효과가 있겠죠,1.0,35,0.7428571428571429
2025.08.20,5점,"지성, 겨울쿨톤, 트러블, 모공",한달이상사용,Very good product :) i love anua,Very good product :) i love anua,Very gd product i love anua,0.4,27,0.0
2025.08.19,5점,,한달이상사용,"본인이 민감성 피부라 그런지 쓰고 트러블이 자주 올라오길래 엄마한테 토스함… 엄마는 굉장이 잘쓰셧음
어느날 다 썻다며 또 사달라하심.

피부타입 잘 고려해서 구매하는걸 추천드려요😽","본인이 민감성 피부라 그런지 쓰고 트러블이 자주 올라오길래 엄마한테 토스함… 엄마는 굉장이 잘쓰셧음
어느날 다 썻다며 또 사달라하심.

피부타입 잘 고려해서 구매하는걸 추천드려요😽",본인이 민감성 피부라 그런지 쓰고 트러블이 자주 올라오길래 엄마한테 토스함 엄마는 굉장이 잘쓰셧음 어느날 다 썻다며 또 사달라하심. 피부타입 잘 고려해서 구매하는걸 추천드려요,1.0,97,0.7628865979381443
2025.08.18,5점,,,복숭아 팩 써보고 효과가 미쳐서 세럼으로도 구매해봤어요 너무 좋네용,복숭아 팩 써보고 효과가 미쳐서 세럼으로도 구매해봤어요 너무 좋네용,복숭아 팩 써보고 효과가 미쳐서 세럼으로도 구매해봤어요 너무 좋네용,1.0,37,0.7837837837837838
2025.08.17,3점,"복합성, 여름쿨톤, 각질, 트러블",,"효과 못 봤어여
근데 트러블은 안 나여
그래서 그냥 화장 하기 전 기초 할 때 대충 쓰고 있어여
미백기능 바라는 거면 딴 거 사세여","효과 못 봤어여
근데 트러블은 안 나여
그래서 그냥 화장 하기 전 기초 할 때 대충 쓰고 있어여
미백기능 바라는 거면 딴 거 사세여",효과 못 봤어여 근데 트러블은 안 나여 그래서 그냥 화장 하기 전 기초 할 때 대충 쓰고 있어여 미백기능 바라는 거면 딴 거 사세여,1.0,73,0.684931506849315
