날짜,별점,스킨타입,태그,리뷰내용,raw_text,clean_text,quality_score,length,korean_ratio
2026.01.21,5점,,한달이상사용,명동에 갔을 때 직원분 추천으로 샀는데 무난하니 좋은 것 같아요,명동에 갔을 때 직원분 추천으로 샀는데 무난하니 좋은 것 같아요,명동에 갔을 때 직원분 추천으로 샀는데 무난하니 좋은 것 같아요,1.0,35,0.7428571428571429
2026.01.17,4점,"지성, 여름쿨톤, 각질, 블랙헤드",한달이상사용,항상 잘 사용 중입니다. 제품은 아내가 항상 좋다고 얘기하고 신제품 나오면 항상 사용하려고 합니다,항상 잘 사용 중입니다. 제품은 아내가 항상 좋다고 얘기하고 신제품 나오면 항상 사용하려고 합니다,항상 잘 사용 중입니다. 제품은 아내가 항상 좋다고 얘기하고 신제품 나오면 항상 사용하려고 합니다,1.0,54,0.7407407407407407
2026.01.16,5점,,한달이상사용,"한 통 꼬박꼬박 두 번씩 발랐는데 효과는 사실 모르겠고
그냥 보습 잘 됨 그나마 좀 맑아진 느낌은 있는듯..? 없는듯..? 근데 생긴게 넘 이뻐서 또 살거임","한 통 꼬박꼬박 두 번씩 발랐는데 효과는 사실 모르겠고
그냥 보습 잘 됨 그나마 좀 맑아진 느낌은 있는듯..? 없는듯..? 근데 생긴게 넘 이뻐서 또 살거임",한 통 꼬박꼬박 두 번씩 발랐는데 효과는 사실 모르겠고 그냥 보습 잘 됨 그나마 좀 맑아진 느낌은 있는듯 없는듯 근데 생긴게 넘 이뻐서 또 살거임,1.0,81,0.7037037037037037
2026.01.12,5점,,,복숭아향 은은해서 바를 때 기분 좋아짐 🍑 제형 가볍고 끈적임 없어서 바로 흡수됨. 나이아신아마이드 들어가서 톤 정리되는 느낌 있고 메이크업 전에 써도 밀림 없음. 자극 없이 데일리로 쓰기 딱 좋은 세럼임 👍,복숭아향 은은해서 바를 때 기분 좋아짐 🍑 제형 가볍고 끈적임 없어서 바로 흡수됨. 나이아신아마이드 들어가서 톤 정리되는 느낌 있고 메이크업 전에 써도 밀림 없음. 자극 없이 데일리로 쓰기 딱 좋은 세럼임 👍,복숭아향 은은해서 바를 때 기분 좋아짐 제형 가볍고 끈적임 없어서 바로 흡수됨. 나이아신아마이드 들어가서 톤 정리되는 느낌 있고 메이크업 전에 써도 밀림 없음. 자극 없이 데일리로 쓰기 딱 좋은 세럼임,1.0,112,0.7232142857142857
2026.01.07,5점,,재구매,"제형이 가볍고 흡수가 빠른 편이라 끈적임 싫어하는 사람에게 좋아요. 꾸준히 바르니 피부 톤이 균일해지는 느낌이 있었고, 자극 없이 데일리로 쓰기 무난했습니다.","제형이 가볍고 흡수가 빠른 편이라 끈적임 싫어하는 사람에게 좋아요. 꾸준히 바르니 피부 톤이 균일해지는 느낌이 있었고, 자극 없이 데일리로 쓰기 무난했습니다.","제형이 가볍고 흡수가 빠른 편이라 끈적임 싫어하는 사람에게 좋아요. 꾸준히 바르니 피부 톤이 균일해지는 느낌이 있었고, 자극 없이 데일리로 쓰기 무난했습니다.",1.0,88,0.7386363636363636
2026.01.07,5점,,한달이상사용,한 달 내내 사용해보니 과하지 않은 구성이라 꾸준히 쓰기 좋았습니다. 자연스럽게 이어지는 흐름이 안정적이어서 만족스럽게 느껴졌습니다. 다양한 상황에서도 무리 없었습니다.,한 달 내내 사용해보니 과하지 않은 구성이라 꾸준히 쓰기 좋았습니다. 자연스럽게 이어지는 흐름이 안정적이어서 만족스럽게 느껴졌습니다. 다양한 상황에서도 무리 없었습니다.,한 달 내내 사용해보니 과하지 않은 구성이라 꾸준히 쓰기 좋았습니다. 자연스럽게 이어지는 흐름이 안정적이어서 만족스럽게 느껴졌습니다. 다양한 상황에서도 무리 없었습니다.,1.0,94,0.7659574468085106
2026.01.06,5점,,,향도 좋고 재구매템이애요! 진심으로 사랑합니다 미백도 됀다는데 그건 아직 효과를 모르겠어요,향도 좋고 재구매템이애요! 진심으로 사랑합니다 미백도 됀다는데 그건 아직 효과를 모르겠어요,향도 좋고 재구매템이애요! 진심으로 사랑합니다 미백도 됀다는데 그건 아직 효과를 모르겠어요,1.0,50,0.78
2026.01.06,5점,"건성, 봄웜톤",,이거 사용했는데 한 일주일만 지나도 얼굴이 화사해지는게 느껴져요!,이거 사용했는데 한 일주일만 지나도 얼굴이 화사해지는게 느껴져요!,이거 사용했는데 한 일주일만 지나도 얼굴이 화사해지는게 느껴져요!,1.0,36,0.7777777777777778
2026.01.03,5점,,한달이상사용,고딩 딸아이가 갖구 싶어해서 구매해줬네요~ 순하고 좋다네요~ 굿입니당~,고딩 딸아이가 갖구 싶어해서 구매해줬네요~ 순하고 좋다네요~ 굿입니당~,고딩 딸아이가 갖구 싶어해서 구매해줬네요 순하고 좋다네요 굿입니당,1.0,36,0.8055555555555556
2026.01.01,5점,,,"이거 진짜 좋음요
이거 하고 피부에 광이 돋는걸 느꼈어요
얼굴톤도 환해지고 결도 부드러워지고 넘 좋음!","이거 진짜 좋음요
이거 하고 피부에 광이 돋는걸 느꼈어요
얼굴톤도 환해지고 결도 부드러워지고 넘 좋음!",이거 진짜 좋음요 이거 하고 피부에 광이 돋는걸 느꼈어요 얼굴톤도 환해지고 결도 부드러워지고 넘 좋음!,1.0,57,0.7368421052631579
2025.12.22,5점,,재구매,피부 결이 매끈해져서 좋아요. 촉촉해졌어요 추천 드려요 ㅎㅎ!!,피부 결이 매끈해져서 좋아요. 촉촉해졌어요 추천 드려요 ㅎㅎ!!,피부 결이 매끈해져서 좋아요. 촉촉해졌어요 추천 드려요 !,1.0,32,0.71875
2025.12.22,5점,,재구매,향이 너무 좋아서 매일 사용하고 싶어요. 기분 전환에 딱이에요. ㅎㅎ추천 드려요!!,향이 너무 좋아서 매일 사용하고 싶어요. 기분 전환에 딱이에요. ㅎㅎ추천 드려요!!,향이 너무 좋아서 매일 사용하고 싶어요. 기분 전환에 딱이에요. 추천 드려요!,1.0,43,0.6976744186046512
2025.12.19,5점,,,친구가 이걸 꼭 갖고 싶다길래 사줬는데 너무 좋아해요 굿굿입니다,친구가 이걸 꼭 갖고 싶다길래 사줬는데 너무 좋아해요 굿굿입니다,친구가 이걸 꼭 갖고 싶다길래 사줬는데 너무 좋아해요 굿굿입니다,1.0,35,0.7714285714285715
2025.12.18,3점,,한달이상사용,이거만 쓰면 좁쌀 개올라오고 복구하기 어려움 진짜... 화잘먹인건 ㅇㅈ하는데 다른 화잘먹템들도 많음 굳이 이거 살 필요 없음,이거만 쓰면 좁쌀 개올라오고 복구하기 어려움 진짜... 화잘먹인건 ㅇㅈ하는데 다른 화잘먹템들도 많음 굳이 이거 살 필요 없음,이거만 쓰면 좁쌀 개올라오고 복구하기 어려움 진짜 화잘먹인건 하는데 다른 화잘먹템들도 많음 굳이 이거 살 필요 없음,1.0,64,0.75
2025.12.15,5점,"건성, 여름쿨톤, 잡티, 트러블",,저는 수부지고 그냥 보이길래 구매 한건데 엄청 촉촉하고 묽은 타입의 세럼이에요 그래서 보습력도 괜찮다고 느꼈어요 그 중에서 미백 효과가 너무 좋아요 미백 효과를 기대하고 산건 아닌데 한 한달정도 꾸준히 쓰다 보니 얼굴이 좀 밝아진 느낌이라 뭐지 싶었는데 이 제품 때문에 그런거 같더라구요!!,저는 수부지고 그냥 보이길래 구매 한건데 엄청 촉촉하고 묽은 타입의 세럼이에요 그래서 보습력도 괜찮다고 느꼈어요 그 중에서 미백 효과가 너무 좋아요 미백 효과를 기대하고 산건 아닌데 한 한달정도 꾸준히 쓰다 보니 얼굴이 좀 밝아진 느낌이라 뭐지 싶었는데 이 제품 때문에 그런거 같더라구요!!,저는 수부지고 그냥 보이길래 구매 한건데 엄청 촉촉하고 묽은 타입의 세럼이에요 그래서 보습력도 괜찮다고 느꼈어요 그 중에서 미백 효과가 너무 좋아요 미백 효과를 기대하고 산건 아닌데 한 한달정도 꾸준히 쓰다 보니 얼굴이 좀 밝아진 느낌이라 뭐지 싶었는데 이 제품 때문에 그런거 같더라구요!,1.0,161,0.7391304347826086
2025.12.12,5점,,,"지인 추천으로 올영세일 때 구매했어요.
복숭아 향을 원체 안좋아했는데 이건 향 호불호를 참고도 바를 수 있는 효과 보장된 세럼입니다.","지인 추천으로 올영세일 때 구매했어요.
복숭아 향을 원체 안좋아했는데 이건 향 호불호를 참고도 바를 수 있는 효과 보장된 세럼입니다.",지인 추천으로 올영세일 때 구매했어요. 복숭아 향을 원체 안좋아했는데 이건 향 호불호를 참고도 바를 수 있는 효과 보장된 세럼입니다.,1.0,74,0.7297297297297297
2025.12.12,5점,,,"피부 자극 없고 촉촉쫀쫀함 미백효과는 모르겠음
근데 이쁘게생겨서 바를때마다 갓생사는것같고 기분이 조아용 한 번쯤 써보는 것도 조을듯","피부 자극 없고 촉촉쫀쫀함 미백효과는 모르겠음
근데 이쁘게생겨서 바를때마다 갓생사는것같고 기분이 조아용 한 번쯤 써보는 것도 조을듯",피부 자극 없고 촉촉쫀쫀함 미백효과는 모르겠음 근데 이쁘게생겨서 바를때마다 갓생사는것같고 기분이 조아용 한 번쯤 써보는 것도 조을듯,1.0,73,0.7808219178082192
2025.12.09,5점,,한달이상사용,미백이 되는 거는 사실 잘 모르겠고 앰플 중에 가장 발랐을 때 부드럽게 피부가 결이 정동되는 것 같아서 샀는데 겨울 정돈이 잘 되고 얼굴이 최근에 뒤집어졌는데 저 앰플을 쓰고 잘 복구가 됐었어요,미백이 되는 거는 사실 잘 모르겠고 앰플 중에 가장 발랐을 때 부드럽게 피부가 결이 정동되는 것 같아서 샀는데 겨울 정돈이 잘 되고 얼굴이 최근에 뒤집어졌는데 저 앰플을 쓰고 잘 복구가 됐었어요,미백이 되는 거는 사실 잘 모르겠고 앰플 중에 가장 발랐을 때 부드럽게 피부가 결이 정동되는 것 같아서 샀는데 겨울 정돈이 잘 되고 얼굴이 최근에 뒤집어졌는데 저 앰플을 쓰고 잘 복구가 됐었어요,1.0,108,0.7222222222222222
2025.12.02,5점,,재구매,여섯 병 째 사용 중 제발사세요. 그냥 사세요. 고민 하지 마세요. 미백효과 짱 좋아요. 아침에 사용 중인데 저녁까지도 화사함이 느껴져요.,여섯 병 째 사용 중 제발사세요. 그냥 사세요. 고민 하지 마세요. 미백효과 짱 좋아요. 아침에 사용 중인데 저녁까지도 화사함이 느껴져요.,여섯 병 째 사용 중 제발사세요. 그냥 사세요. 고민 하지 마세요. 미백효과 짱 좋아요. 아침에 사용 중인데 저녁까지도 화사함이 느껴져요.,1.0,77,0.6883116883116883
2025.11.30,5점,"복합성, 겨울쿨톤, 각질, 피지과다",,그냥 샀는데 생각보다 괜찮았어요 매일 발라주고 있다가 우연히 거울을 봤는데 피부가 밝아져서 놀랫떠염 용기도 이쁘고 자극도 없어서 좋아용,그냥 샀는데 생각보다 괜찮았어요 매일 발라주고 있다가 우연히 거울을 봤는데 피부가 밝아져서 놀랫떠염 용기도 이쁘고 자극도 없어서 좋아용,그냥 샀는데 생각보다 괜찮았어요 매일 발라주고 있다가 우연히 거울을 봤는데 피부가 밝아져서 놀랫떠염 용기도 이쁘고 자극도 없어서 좋아용,1.0,75,0.7733333333333333
2025.11.30,5점,,"한달이상사용, 재구매","제가 건섯피부인데, 발랐을때 피부에너무나 잘 흡수되는 느낌이 너무나 좋았습니다. 피부에 자극없이 잘발라지며 촉촉함과 피부에 탱탱함이 느껴져서 앞으로도 피부에 많은 도움이 될것같습니다. 앞으로도 재구매의향 가득합니다","제가 건섯피부인데, 발랐을때 피부에너무나 잘 흡수되는 느낌이 너무나 좋았습니다. 피부에 자극없이 잘발라지며 촉촉함과 피부에 탱탱함이 느껴져서 앞으로도 피부에 많은 도움이 될것같습니다. 앞으로도 재구매의향 가득합니다","제가 건섯피부인데, 발랐을때 피부에너무나 잘 흡수되는 느낌이 너무나 좋았습니다. 피부에 자극없이 잘발라지며 촉촉함과 피부에 탱탱함이 느껴져서 앞으로도 피부에 많은 도움이 될것같습니다. 앞으로도 재구매의향 가득합니다",1.0,119,0.7815126050420168
2025.11.27,5점,"건성, 겨울쿨톤, 블랙헤드, 민감성",,은은한 복숭아 향이 너무 너무 좋고 약간 묽은 제형이라서 발림성도 좋아요,은은한 복숭아 향이 너무 너무 좋고 약간 묽은 제형이라서 발림성도 좋아요,은은한 복숭아 향이 너무 너무 좋고 약간 묽은 제형이라서 발림성도 좋아요,1.0,40,0.75
2025.11.26,5점,,,순하고 보습잘되서 꾸준히 이용중이에요순하고 보습잘되서 꾸준히 이용중이에요,순하고 보습잘되서 꾸준히 이용중이에요순하고 보습잘되서 꾸준히 이용중이에요,순하고 보습잘되서 꾸준히 이용중이에요순하고 보습잘되서 꾸준히 이용중이에요,1.0,40,0.85
2025.11.26,5점,"잡티, 트러블",한달이상사용,"세럼 필요해서 샀었는데 잘 썼어요
촉촉하고 바르고 나면 피부가 깨끗해지는 기분","세럼 필요해서 샀었는데 잘 썼어요
촉촉하고 바르고 나면 피부가 깨끗해지는 기분",세럼 필요해서 샀었는데 잘 썼어요 촉촉하고 바르고 나면 피부가 깨끗해지는 기분,1.0,43,0.7674418604651163
2025.11.25,5점,,한달이상사용,이거 바르고 화장하면 피부 화장이 잘먹어요!! 자극없이 순해서 좋아요,이거 바르고 화장하면 피부 화장이 잘먹어요!! 자극없이 순해서 좋아요,이거 바르고 화장하면 피부 화장이 잘먹어요! 자극없이 순해서 좋아요,1.0,37,0.7567567567567568
2025.11.24,4점,"지성, 여름쿨톤, 각질, 블랙헤드",,항상 올리브영 잘 사용하고 있어요. 한 달 사용해 보고 좋은지 알 수 있을 것 같아요,항상 올리브영 잘 사용하고 있어요. 한 달 사용해 보고 좋은지 알 수 있을 것 같아요,항상 올리브영 잘 사용하고 있어요. 한 달 사용해 보고 좋은지 알 수 있을 것 같아요,1.0,47,0.6808510638297872
2025.11.20,5점,,,고딩 딸아이가 써보고 싶다해서 올.영 매장 갔을때 구매해줬네여~ 촉촉하니 좋데요~,고딩 딸아이가 써보고 싶다해서 올.영 매장 갔을때 구매해줬네여~ 촉촉하니 좋데요~,고딩 딸아이가 써보고 싶다해서 올.영 매장 갔을때 구매해줬네여 촉촉하니 좋데요,1.0,43,0.7674418604651163
2025.11.18,5점,,,화잘먹 세럼 하얘지는 건 솔직히 모르겟슴... 아누아 걍 화잘먹 제품에 집중하세요,화잘먹 세럼 하얘지는 건 솔직히 모르겟슴... 아누아 걍 화잘먹 제품에 집중하세요,화잘먹 세럼 하얘지는 건 솔직히 모르겟슴 아누아 걍 화잘먹 제품에 집중하세요,1.0,42,0.7619047619047619
2025.11.16,4점,,한달이상사용,보습도 잘 되고 화장 전에 바르면 화장도 잘 먹어서 좋아요 피부톤도 조금 밝아진 것 같아요,보습도 잘 되고 화장 전에 바르면 화장도 잘 먹어서 좋아요 피부톤도 조금 밝아진 것 같아요,보습도 잘 되고 화장 전에 바르면 화장도 잘 먹어서 좋아요 피부톤도 조금 밝아진 것 같아요,1.0,50,0.72
2025.11.16,5점,,,"친구가 추천해줘서 구매했었는데, 역시 좋네요~~!! 세일할 때 저렴하게 샀어요!!","친구가 추천해줘서 구매했었는데, 역시 좋네요~~!! 세일할 때 저렴하게 샀어요!!","친구가 추천해줘서 구매했었는데, 역시 좋네요 세일할 때 저렴하게 샀어요!",1.0,40,0.75
2025.11.13,5점,"민감성, 여름쿨톤, 미백, 트러블",,역시 아누아가 저는 잘 맞아요!! 복합성이라 보습력도 좀 있어야되는데 보급도 잘되고 순해서 거의 4통째? 쓰는거 같아요! 처음에 미백 효과 기대하고 샀는데 조금 하얘진거 같기도 하고…?? 절 모르겠어요ㅋㅋㅎ,역시 아누아가 저는 잘 맞아요!! 복합성이라 보습력도 좀 있어야되는데 보급도 잘되고 순해서 거의 4통째? 쓰는거 같아요! 처음에 미백 효과 기대하고 샀는데 조금 하얘진거 같기도 하고…?? 절 모르겠어요ㅋㅋㅎ,역시 아누아가 저는 잘 맞아요! 복합성이라 보습력도 좀 있어야되는데 보급도 잘되고 순해서 거의 4통째? 쓰는거 같아요! 처음에 미백 효과 기대하고 샀는데 조금 하얘진거 같기도 하고 절 모르겠어요,1.0,108,0.7222222222222222
2025.11.10,5점,,"한달이상사용, 재구매","내 피부도 상큼 😁
미백효과는 솔직히 잘 모르겠구
발림성 부드럽고 사용함에 있어서 불편함은 없어요","내 피부도 상큼 😁
미백효과는 솔직히 잘 모르겠구
발림성 부드럽고 사용함에 있어서 불편함은 없어요",내 피부도 상큼 미백효과는 솔직히 잘 모르겠구 발림성 부드럽고 사용함에 있어서 불편함은 없어요,1.0,52,0.7692307692307693
2025.11.10,5점,,한달이상사용,얼굴이 쫀득쫀득해져서 피부화장이 엄청 잘 먹어요 가벼워서 바르기 좋아여,얼굴이 쫀득쫀득해져서 피부화장이 엄청 잘 먹어요 가벼워서 바르기 좋아여,얼굴이 쫀득쫀득해져서 피부화장이 엄청 잘 먹어요 가벼워서 바르기 좋아여,1.0,39,0.7948717948717948
2025.11.07,5점,,한달이상사용,"처음엔 그냥 괜찮다 싶었는데, 한 달 정도 지나니까 점점 좋아졌어요. 매일 쓰기 편하고, 꾸준히 사용할수록 안정감이 느껴져요.","처음엔 그냥 괜찮다 싶었는데, 한 달 정도 지나니까 점점 좋아졌어요. 매일 쓰기 편하고, 꾸준히 사용할수록 안정감이 느껴져요.","처음엔 그냥 괜찮다 싶었는데, 한 달 정도 지나니까 점점 좋아졌어요. 매일 쓰기 편하고, 꾸준히 사용할수록 안정감이 느껴져요.",1.0,70,0.7142857142857143
2025.11.07,5점,,한달이상사용,피부가 한결 건강해진 느낌이에요. 생기가 생겼어요 추천 드려요 ㅎㅎ!!,피부가 한결 건강해진 느낌이에요. 생기가 생겼어요 추천 드려요 ㅎㅎ!!,피부가 한결 건강해진 느낌이에요. 생기가 생겼어요 추천 드려요 !,1.0,36,0.7222222222222222
2025.11.05,5점,,,보들보들하게 피부를 만들어져서 좋아요 무조건 하루에 한번은 꼭 바르고 있습니다,보들보들하게 피부를 만들어져서 좋아요 무조건 하루에 한번은 꼭 바르고 있습니다,보들보들하게 피부를 만들어져서 좋아요 무조건 하루에 한번은 꼭 바르고 있습니다,1.0,43,0.7906976744186046
2025.11.03,3점,,한달이상사용,자극없이 순하고 촉촉한데 톤업.? 잡티.? 그런건 효과를 딱히 못 본거 같아요,자극없이 순하고 촉촉한데 톤업.? 잡티.? 그런건 효과를 딱히 못 본거 같아요,자극없이 순하고 촉촉한데 톤업.? 잡티.? 그런건 효과를 딱히 못 본거 같아요,1.0,43,0.6744186046511628
2025.11.01,5점,,한달이상사용,복숭아 마스크 러버여서 .. 구매해봤는데 마스크가 더 효과가 좋은듯합니다,복숭아 마스크 러버여서 .. 구매해봤는데 마스크가 더 효과가 좋은듯합니다,복숭아 마스크 러버여서 . 구매해봤는데 마스크가 더 효과가 좋은듯합니다,1.0,39,0.7692307692307693
2025.10.29,5점,,한달이상사용,음…전 피부가 좋은 편이라 효과를 잘 모르겠어요 어떤 기초 제품을 발라도 큰 효과를 못 보네요,음…전 피부가 좋은 편이라 효과를 잘 모르겠어요 어떤 기초 제품을 발라도 큰 효과를 못 보네요,음전 피부가 좋은 편이라 효과를 잘 모르겠어요 어떤 기초 제품을 발라도 큰 효과를 못 보네요,1.0,51,0.7254901960784313
2025.10.27,5점,,한달이상사용,가벼운 제형이라 가을 겨울에 쓰면 건조할꺼 같아요! 봄 여름에 좋을듯! 이거 쓰고 피부가 맑아졌어요!! 극 건성분들은 봄 여름 아침에 스킨 바르고 앰플을 이것으로 발라주면 좋을꺼 같아요! 가을 겨울은 비추ㅠㅠ,가벼운 제형이라 가을 겨울에 쓰면 건조할꺼 같아요! 봄 여름에 좋을듯! 이거 쓰고 피부가 맑아졌어요!! 극 건성분들은 봄 여름 아침에 스킨 바르고 앰플을 이것으로 발라주면 좋을꺼 같아요! 가을 겨울은 비추ㅠㅠ,가벼운 제형이라 가을 겨울에 쓰면 건조할꺼 같아요! 봄 여름에 좋을듯! 이거 쓰고 피부가 맑아졌어요! 극 건성분들은 봄 여름 아침에 스킨 바르고 앰플을 이것으로 발라주면 좋을꺼 같아요! 가을 겨울은 비추,1.0,113,0.7168141592920354
2025.10.27,5점,,한달이상사용,솔직히 드라마틱한 혀과는 모르겠구 그냥저냥 씅만한 것 가타요,솔직히 드라마틱한 혀과는 모르겠구 그냥저냥 씅만한 것 가타요,솔직히 드라마틱한 혀과는 모르겠구 그냥저냥 씅만한 것 가타요,1.0,33,0.7878787878787878
2025.10.24,3점,"지성, 가을웜톤, 각질, 블랙헤드",한달이상사용,미묘하네... 원래 다른 기기로 썼었어서 그땐 몰랐는데 손으로 바르니까 찐덕함,미묘하네... 원래 다른 기기로 썼었어서 그땐 몰랐는데 손으로 바르니까 찐덕함,미묘하네 원래 다른 기기로 썼었어서 그땐 몰랐는데 손으로 바르니까 찐덕함,1.0,40,0.775
2025.10.23,4점,,,미백효과는 못 본 것 같아요 그래도 무난하게 쓰기 나쁘지않아요,미백효과는 못 본 것 같아요 그래도 무난하게 쓰기 나쁘지않아요,미백효과는 못 본 것 같아요 그래도 무난하게 쓰기 나쁘지않아요,1.0,34,0.7647058823529411
2025.10.22,3점,"복합성, 여름쿨톤, 각질, 트러블",한달이상사용,"효과를 진자 모르게성요
뭐가변화된건지모르겟어서
걍화장하기전기초할때쓰고있떠용
뭐가나진않음","효과를 진자 모르게성요
뭐가변화된건지모르겟어서
걍화장하기전기초할때쓰고있떠용
뭐가나진않음",효과를 진자 모르게성요 뭐가변화된건지모르겟어서 걍화장하기전기초할때쓰고있떠용 뭐가나진않음,1.0,48,0.8958333333333334
2025.10.21,4점,,,미백에는 잘 모르겠고 보습에는 좋은것 같아요.아누아는 다 보습에 좋은것 같아요,미백에는 잘 모르겠고 보습에는 좋은것 같아요.아누아는 다 보습에 좋은것 같아요,미백에는 잘 모르겠고 보습에는 좋은것 같아요.아누아는 다 보습에 좋은것 같아요,1.0,43,0.7674418604651163
2025.10.19,4점,"지성, 여름쿨톤, 잡티, 블랙헤드",한달이상사용,요철은 잘 모르갰다만 민감성 피부로 요거 계속 쓸때마다 자꾸 뭐가 올라와서 손이 잘 안감,요철은 잘 모르갰다만 민감성 피부로 요거 계속 쓸때마다 자꾸 뭐가 올라와서 손이 잘 안감,요철은 잘 모르갰다만 민감성 피부로 요거 계속 쓸때마다 자꾸 뭐가 올라와서 손이 잘 안감,1.0,49,0.7346938775510204
2025.10.17,5점,,한달이상사용,"이건 처음 쓸때부터 좋은데
여전히 좋아요 미백은 잘 모르겠는데
피부가 부들부들","이건 처음 쓸때부터 좋은데
여전히 좋아요 미백은 잘 모르겠는데
피부가 부들부들",이건 처음 쓸때부터 좋은데 여전히 좋아요 미백은 잘 모르겠는데 피부가 부들부들,1.0,43,0.7674418604651163
2025.10.12,3점,,,미백이나 그런건 잘 모르겠고 휘뚤마뚤 바름..근데 묘하게 겉도는 느낌이 약간 있음 걍 제가 예민해서 그럴수도..,미백이나 그런건 잘 모르겠고 휘뚤마뚤 바름..근데 묘하게 겉도는 느낌이 약간 있음 걍 제가 예민해서 그럴수도..,미백이나 그런건 잘 모르겠고 휘뚤마뚤 바름.근데 묘하게 겉도는 느낌이 약간 있음 걍 제가 예민해서 그럴수도.,1.0,60,0.7333333333333333
2025.10.12,5점,,한달이상사용,너무 만족스럽게 잘 사용하고 있습니다. 다 쓰고 추가 구매하려구요 후기보고 주문했는데 좋은 구매해서 기분이 좋네요,너무 만족스럽게 잘 사용하고 있습니다. 다 쓰고 추가 구매하려구요 후기보고 주문했는데 좋은 구매해서 기분이 좋네요,너무 만족스럽게 잘 사용하고 있습니다. 다 쓰고 추가 구매하려구요 후기보고 주문했는데 좋은 구매해서 기분이 좋네요,1.0,63,0.7619047619047619
2025.10.02,5점,,한달이상사용,"이건 아침케어에 사용중인데 없으면 안되는 존재에요
진짜 좋어요
기름도 덜생기고","이건 아침케어에 사용중인데 없으면 안되는 존재에요
진짜 좋어요
기름도 덜생기고",이건 아침케어에 사용중인데 없으면 안되는 존재에요 진짜 좋어요 기름도 덜생기고,1.0,43,0.7906976744186046
2025.10.02,5점,"민감성, 봄웜톤, 각질, 트러블",,"진짜 거칠던 결이 세상 보들보들한 애기피부가
되었어여..ꢭ 이거 진짜 인생템 등극..!!!","진짜 거칠던 결이 세상 보들보들한 애기피부가
되었어여..ꢭ 이거 진짜 인생템 등극..!!!",진짜 거칠던 결이 세상 보들보들한 애기피부가 되었어여.ꢭ 이거 진짜 인생템 등극,1.0,44,0.7272727272727273
