날짜,별점,스킨타입,태그,리뷰내용,raw_text,clean_text,quality_score,length,korean_ratio
2025.09.05,5점,"복합성, 봄웜톤, 잡티, 각질",한달이상사용,"벌써 3통째 사용했고 2통 더 구매했어요
반심반의 하면서 첫 통 썼을때 다음날 바로 효과가 나타나서 솔직히 놀랐는데, 뻘겋고 터진 곳에 바르면 확실히 다음날부터 바를때까지 가라앉는게 보여요
좁쌀 같은 곳 에는 효과 없구요 터트리거나 빨갛게 무르익으면 좋아져요
단점이있다면 용기 좀 부드러운 튜브형으로 바꿔줬으면 좋겠어요 마지막 짤때 너무 힘들어요","벌써 3통째 사용했고 2통 더 구매했어요
반심반의 하면서 첫 통 썼을때 다음날 바로 효과가 나타나서 솔직히 놀랐는데, 뻘겋고 터진 곳에 바르면 확실히 다음날부터 바를때까지 가라앉는게 보여요
좁쌀 같은 곳 에는 효과 없구요 터트리거나 빨갛게 무르익으면 좋아져요
단점이있다면 용기 좀 부드러운 튜브형으로 바꿔줬으면 좋겠어요 마지막 짤때 너무 힘들어요","벌써 3통째 사용했고 2통 더 구매했어요 반심반의 하면서 첫 통 썼을때 다음날 바로 효과가 나타나서 솔직히 놀랐는데, 뻘겋고 터진 곳에 바르면 확실히 다음날부터 바를때까지 가라앉는게 보여요 좁쌀 같은 곳 에는 효과 없구요 터트리거나 빨갛게 무르익으면 좋아져요 단점이있다면 용기 좀 부드러운 튜브형으로 바꿔줬으면 좋겠어요 마지막 짤때 너무 힘들어요",1.0,193,0.7461139896373057
2025.09.05,3점,,한달이상사용,유분감이 좀 있어서 지성에겐 별로 추천 안합니다 그래도 참을 만은 행ㅅ 바르고 자면 다음날에 좀 진정되어있고 작은거는 사라지기도 합니다 추천,유분감이 좀 있어서 지성에겐 별로 추천 안합니다 그래도 참을 만은 행ㅅ 바르고 자면 다음날에 좀 진정되어있고 작은거는 사라지기도 합니다 추천,유분감이 좀 있어서 지성에겐 별로 추천 안합니다 그래도 참을 만은 행 바르고 자면 다음날에 좀 진정되어있고 작은거는 사라지기도 합니다 추천,1.0,77,0.7532467532467533
2025.09.05,3점,,한달이상사용,좋음 근데 꾸준히 2-3통은 발라야 할 것 같아요 효과는 그저 그럼,좋음 근데 꾸준히 2-3통은 발라야 할 것 같아요 효과는 그저 그럼,좋음 근데 꾸준히 2-3통은 발라야 할 것 같아요 효과는 그저 그럼,1.0,37,0.6486486486486487
2025.09.05,5점,,,아직 트러블에 직접적으로 효과는 모르겠는데 아누아 어성초 라인이 저한테 잘 맞아서 믿고 씁니다! 자극없이 순하고 유분기 없이 촉촉해서 수부지 피부에 좋아여,아직 트러블에 직접적으로 효과는 모르겠는데 아누아 어성초 라인이 저한테 잘 맞아서 믿고 씁니다! 자극없이 순하고 유분기 없이 촉촉해서 수부지 피부에 좋아여,아직 트러블에 직접적으로 효과는 모르겠는데 아누아 어성초 라인이 저한테 잘 맞아서 믿고 씁니다! 자극없이 순하고 유분기 없이 촉촉해서 수부지 피부에 좋아여,1.0,86,0.7558139534883721
2025.09.04,5점,,,원래 공홈에서 구매했었는데 귀찮아서 올영으로 재구매해요,원래 공홈에서 구매했었는데 귀찮아서 올영으로 재구매해요,원래 공홈에서 구매했었는데 귀찮아서 올영으로 재구매해요,1.0,30,0.8333333333333334
2025.09.04,5점,,,피부가 엄청 예민한데 바르고 뒤집어지고 그런건 없었어요! 촉촉해요!,피부가 엄청 예민한데 바르고 뒤집어지고 그런건 없었어요! 촉촉해요!,피부가 엄청 예민한데 바르고 뒤집어지고 그런건 없었어요! 촉촉해요!,1.0,37,0.7567567567567568
2025.09.04,5점,,재구매,이거 진짜. ㄹㅈㄷ 요물 !!! 올라오려는 녀석한테 며칠 발라주면 싸악 가라앉아요 이거 바른 뒤로 새로 올라오는 녀석도 없어서 참 좋습니다,이거 진짜. ㄹㅈㄷ 요물 !!! 올라오려는 녀석한테 며칠 발라주면 싸악 가라앉아요 이거 바른 뒤로 새로 올라오는 녀석도 없어서 참 좋습니다,이거 진짜. 요물 올라오려는 녀석한테 며칠 발라주면 싸악 가라앉아요 이거 바른 뒤로 새로 올라오는 녀석도 없어서 참 좋습니다,1.0,69,0.7391304347826086
2025.09.04,5점,"지성, 여름쿨톤, 잡티, 미백",,스팟케어용 정확히는 압출 후 케어용으로 사봤는데요 저렴한 편도 아닌 게 효과도 딱히 없네요ㅜㅜ 튜브가 아니고 이걸 머라 하지 짜기도 쉽지 않은 재질이라 추천은 안 합니다! 다이소에 해서린 스팟 연고 좋다길래 그거 사보려구요,스팟케어용 정확히는 압출 후 케어용으로 사봤는데요 저렴한 편도 아닌 게 효과도 딱히 없네요ㅜㅜ 튜브가 아니고 이걸 머라 하지 짜기도 쉽지 않은 재질이라 추천은 안 합니다! 다이소에 해서린 스팟 연고 좋다길래 그거 사보려구요,스팟케어용 정확히는 압출 후 케어용으로 사봤는데요 저렴한 편도 아닌 게 효과도 딱히 없네요 튜브가 아니고 이걸 머라 하지 짜기도 쉽지 않은 재질이라 추천은 안 합니다! 다이소에 해서린 스팟 연고 좋다길래 그거 사보려구요,1.0,122,0.7377049180327869
2025.09.04,5점,,,"진정 시카성분이 진짜 듬뿍 응축된 크림이란 느낌이들어요!! 바를때 쿨링감, 시간지나 보습감 모두 좋은 제품!!!","진정 시카성분이 진짜 듬뿍 응축된 크림이란 느낌이들어요!! 바를때 쿨링감, 시간지나 보습감 모두 좋은 제품!!!","진정 시카성분이 진짜 듬뿍 응축된 크림이란 느낌이들어요! 바를때 쿨링감, 시간지나 보습감 모두 좋은 제품",1.0,58,0.7413793103448276
2025.09.04,5점,,,부작용도 없고 듬뿍 바르고 자면 진정되는게 느껴져요~ 꾸준히 사용해보려구요ㅎㅎ,부작용도 없고 듬뿍 바르고 자면 진정되는게 느껴져요~ 꾸준히 사용해보려구요ㅎㅎ,부작용도 없고 듬뿍 바르고 자면 진정되는게 느껴져요 꾸준히 사용해보려구요,1.0,40,0.8
2025.09.04,5점,,한달이상사용,동생이 사달라해서 사줬는데 좋긴 좋은가봐요. 나한테 개큰추천하고감.. 근데 그거 내 돈이잔아.. 트러블 엄청 잘 내려가고 피부 되게 금방 좋아지는거 같대요.,동생이 사달라해서 사줬는데 좋긴 좋은가봐요. 나한테 개큰추천하고감.. 근데 그거 내 돈이잔아.. 트러블 엄청 잘 내려가고 피부 되게 금방 좋아지는거 같대요.,동생이 사달라해서 사줬는데 좋긴 좋은가봐요. 나한테 개큰추천하고감. 근데 그거 내 돈이잔아. 트러블 엄청 잘 내려가고 피부 되게 금방 좋아지는거 같대요.,1.0,85,0.7294117647058823
2025.09.04,5점,,,얼굴 전체에 바르기에는 너무 어까울 것 같고 아직 안써봤는데 붉은 잡티들이 다 사라졌으면 좋겠습니다..🙏,얼굴 전체에 바르기에는 너무 어까울 것 같고 아직 안써봤는데 붉은 잡티들이 다 사라졌으면 좋겠습니다..🙏,얼굴 전체에 바르기에는 너무 어까울 것 같고 아직 안써봤는데 붉은 잡티들이 다 사라졌으면 좋겠습니다,1.0,55,0.7636363636363637
2025.09.04,1점,,,그냥 사지마세요… 광고에 떠서 폼클렌징이랑 같이 주문했는데 효과 ㅈㄴ 없어요 ㅎ 조금 무거운 제형이고 지성이신 분들은 유분기 좀 있을 거 같아요,그냥 사지마세요… 광고에 떠서 폼클렌징이랑 같이 주문했는데 효과 ㅈㄴ 없어요 ㅎ 조금 무거운 제형이고 지성이신 분들은 유분기 좀 있을 거 같아요,그냥 사지마세요 광고에 떠서 폼클렌징이랑 같이 주문했는데 효과 없어요 조금 무거운 제형이고 지성이신 분들은 유분기 좀 있을 거 같아요,1.0,74,0.7567567567567568
2025.09.03,5점,,,"엥 사바사 라고 하는데 전 진짜 개 좋아요 이마 쪽에 특히
그날 전에는 좁쌀 엄청 올라오는데 바르고 자면 다음날 기름기가 범벅이지만 잠 푹~잔거 같은 반들함? 이고 좁쌀도 진짜 많이 안 나요 재구매 무조건임 ㅜ","엥 사바사 라고 하는데 전 진짜 개 좋아요 이마 쪽에 특히
그날 전에는 좁쌀 엄청 올라오는데 바르고 자면 다음날 기름기가 범벅이지만 잠 푹~잔거 같은 반들함? 이고 좁쌀도 진짜 많이 안 나요 재구매 무조건임 ㅜ",엥 사바사 라고 하는데 전 진짜 개 좋아요 이마 쪽에 특히 그날 전에는 좁쌀 엄청 올라오는데 바르고 자면 다음날 기름기가 범벅이지만 잠 푹잔거 같은 반들함? 이고 좁쌀도 진짜 많이 안 나요 재구매 무조건임,1.0,114,0.7105263157894737
2025.11.02,5점,,한달이상사용,트러블흔적에 효과있는 것 같아요. 1달 정도 발랐더니 흔적이 좀 옅어졌어요,트러블흔적에 효과있는 것 같아요. 1달 정도 발랐더니 흔적이 좀 옅어졌어요,트러블흔적에 효과있는 것 같아요. 1달 정도 발랐더니 흔적이 좀 옅어졌어요,1.0,41,0.7317073170731707
2025.09.03,4점,,,순하고 단시간 진정 시켜주고 끈적임은 있지만 효과는 좋아요 3일차 부터 효과가 나타나요,순하고 단시간 진정 시켜주고 끈적임은 있지만 효과는 좋아요 3일차 부터 효과가 나타나요,순하고 단시간 진정 시켜주고 끈적임은 있지만 효과는 좋아요 3일차 부터 효과가 나타나요,1.0,48,0.75
2025.09.03,4점,,한달이상사용,피부 압출한날이나 흉터에 발라주먄 다른 연고보다 진정이 빨라여,피부 압출한날이나 흉터에 발라주먄 다른 연고보다 진정이 빨라여,피부 압출한날이나 흉터에 발라주먄 다른 연고보다 진정이 빨라여,1.0,34,0.7941176470588235
2025.09.02,5점,,한달이상사용,피부에 여드름이라기엔 더 까다로운? 뾰루지들에 좋은거같어요 저는 피부 뒤집어졌을 때 얘를 진짜 드으음뿍 바르고 자요 그러면 다음날에 한결 낫더라구요!,피부에 여드름이라기엔 더 까다로운? 뾰루지들에 좋은거같어요 저는 피부 뒤집어졌을 때 얘를 진짜 드으음뿍 바르고 자요 그러면 다음날에 한결 낫더라구요!,피부에 여드름이라기엔 더 까다로운? 뾰루지들에 좋은거같어요 저는 피부 뒤집어졌을 때 얘를 진짜 드으음뿍 바르고 자요 그러면 다음날에 한결 낫더라구요!,1.0,83,0.7590361445783133
2025.09.02,5점,,,바르고 나면 약간 유분? 기름기?가 남아요ㅠ 광고만큼 좋은지는 모르겠어요,바르고 나면 약간 유분? 기름기?가 남아요ㅠ 광고만큼 좋은지는 모르겠어요,바르고 나면 약간 유분? 기름기?가 남아요 광고만큼 좋은지는 모르겠어요,1.0,39,0.7435897435897436
2025.09.02,5점,,재구매,"항상 재구매 입니다!!~
좋아요~~
다음에 또 사러 올께요~~","항상 재구매 입니다!!~
좋아요~~
다음에 또 사러 올께요~~",항상 재구매 입니다 좋아요 다음에 또 사러 올께요,0.8,27,0.7407407407407407
2025.09.02,5점,,,"아들이 인스타 보고 여드름에 좋다해서 구매해봤네요
효과 있었음 좋겠어요","아들이 인스타 보고 여드름에 좋다해서 구매해봤네요
효과 있었음 좋겠어요",아들이 인스타 보고 여드름에 좋다해서 구매해봤네요 효과 있었음 좋겠어요,1.0,39,0.7948717948717948
2025.09.01,5점,,,연고 아주 잘쓰고있습니다 효과직빵입니다 여러분도 구매해서 쓰십쇼,연고 아주 잘쓰고있습니다 효과직빵입니다 여러분도 구매해서 쓰십쇼,연고 아주 잘쓰고있습니다 효과직빵입니다 여러분도 구매해서 쓰십쇼,1.0,35,0.8285714285714286
2025.09.01,5점,,,여드름 많이 난 딸 위해서 주문했는데 효과있길~ 아는동생써보고 효과좋다네요.,여드름 많이 난 딸 위해서 주문했는데 효과있길~ 아는동생써보고 효과좋다네요.,여드름 많이 난 딸 위해서 주문했는데 효과있길 아는동생써보고 효과좋다네요.,1.0,41,0.7804878048780488
2025.09.01,4점,,한달이상사용,인스타에 광고로 너무 많이 떠서 써좠는데 그냥저냥 그래여 ㅠㅠ,인스타에 광고로 너무 많이 떠서 써좠는데 그냥저냥 그래여 ㅠㅠ,인스타에 광고로 너무 많이 떠서 써좠는데 그냥저냥 그래여,1.0,31,0.7741935483870968
2025.09.01,5점,,,제 인생 크림… 틱톡 광고 보고 속은셈치고 샀는데 ㄹㅈㄷ 화농성에 두껍게 올리고 자묜 담날 다 없어짐,제 인생 크림… 틱톡 광고 보고 속은셈치고 샀는데 ㄹㅈㄷ 화농성에 두껍게 올리고 자묜 담날 다 없어짐,제 인생 크림 틱톡 광고 보고 속은셈치고 샀는데 화농성에 두껍게 올리고 자묜 담날 다 없어짐,1.0,51,0.7254901960784313
2025.09.01,5점,,재구매,진짜 처음에는 효과를 잘 몰랐는데 쓰다가 안쓰면 효과가 느껴져서 없어지면 바로 사요!,진짜 처음에는 효과를 잘 몰랐는데 쓰다가 안쓰면 효과가 느껴져서 없어지면 바로 사요!,진짜 처음에는 효과를 잘 몰랐는데 쓰다가 안쓰면 효과가 느껴져서 없어지면 바로 사요!,1.0,47,0.7446808510638298
2025.09.01,5점,,한달이상사용,사촌동생이 여드름 흔적이 고민이라해서 같이 사버ㅏㅆ습니다,사촌동생이 여드름 흔적이 고민이라해서 같이 사버ㅏㅆ습니다,사촌동생이 여드름 흔적이 고민이라해서 같이 사버습니다,0.8,29,0.8275862068965517
2025.09.01,5점,"복합성, 웜톤, 트러블, 모공","한달이상사용, 재구매",광고처럼 여드름 피부가 꺠끗하게 되진 않지만 붉은기가 가라앉긴 해요. 확실히 사용하기 전이랑 후가 차이가 나서 요즘 항상 쓰고 있어요!!!,광고처럼 여드름 피부가 꺠끗하게 되진 않지만 붉은기가 가라앉긴 해요. 확실히 사용하기 전이랑 후가 차이가 나서 요즘 항상 쓰고 있어요!!!,광고처럼 여드름 피부가 꺠끗하게 되진 않지만 붉은기가 가라앉긴 해요. 확실히 사용하기 전이랑 후가 차이가 나서 요즘 항상 쓰고 있어요,1.0,74,0.7432432432432432
2025.09.01,4점,,,어성초가 여드름에 좋다고해서 정착해보려고 구매했는대 너무너무 좋아요!,어성초가 여드름에 좋다고해서 정착해보려고 구매했는대 너무너무 좋아요!,어성초가 여드름에 좋다고해서 정착해보려고 구매했는대 너무너무 좋아요!,1.0,38,0.8157894736842105
2025.09.01,2점,,,"광고따라 샀더니 다들 자기가 어성초에 잘맞는지 보고 사세유... 얼굴후끈하고 뒤집어지고 간지럽고 난리났어요...ㅎㅎ
그치만 친구는 잘 맞다고 하더라구요","광고따라 샀더니 다들 자기가 어성초에 잘맞는지 보고 사세유... 얼굴후끈하고 뒤집어지고 간지럽고 난리났어요...ㅎㅎ
그치만 친구는 잘 맞다고 하더라구요",광고따라 샀더니 다들 자기가 어성초에 잘맞는지 보고 사세유 얼굴후끈하고 뒤집어지고 간지럽고 난리났어요 그치만 친구는 잘 맞다고 하더라구요,1.0,76,0.7894736842105263
2025.09.01,5점,,,"[2달 사용 후기]
리뷰 잘 안쓰는데 저는 정말 레전드 효과를 봐서 다시 사려고 들어왔다가 안좋은 리뷰가 넘 많아 리뷰남겨요

-구매동기
제가 성인이 되고 2-3년전부터 갑자기 학생때도 안나던 여드름이
생겨서 안없어지더니 완전히 피부가 여드름 피부로 바뀐거에요..

특히 이마에 괴물같이 가로로 쭈루룩 큰 여드름이 크고 딱딱하게 여러개 생겨서 화장으로 커버도 안되고..
약국에서 여드름 연고 종류별로 다 써 보았지만 하나 없어지면 없어질때쯤 옆에 하나올라오고 그러더라고요..?
게다가 양도 엄청 조금인데 가격은또 비싸서 부담스럽고,,
의료용 바늘로 짜보기도 했는데 깊게찔러서 흉진것도 있고
출근하면 사람들이 놀라면서 여드름이 점점 심해진다고 하는데
진짜 스트레스였어요ㅜㅜ

뭘해도 안없어 지길래 생각해낸게 3년전엔 피부가 막 좋은건 아니여도 여드름이 하나도 없었거든요. 그래서 그때 쓰던 스킨케어 제품으로 싹 풀체인지 해야겠다고 큰맘 먹고 올영 앱에 들어왔어요.

그때 아누아 어성초80 앰플을 주변에 추천하고 선물할 정도로 엄청 애정했어서 앰플을 구매하려고 아누아에 들어왔다가 스팟크림이 출시된걸보고 믿고 질렀어요

-리얼후기
1일차 사용후기.. 낮에도 발라도 되고, 밤엔 연고처럼 두껍게 발라주면 된다라고 써있었던거같아요(원래 설명서같은거 잘안봄)

그래서 낮에 택배오자마자 전체적으로 살살 발라주고, 밤에 자기전에 연고처럼 여드름에만 좀 두껍게 발라줬어요 아까워서 듬뿍은 자제했어요 항상
자고 일어났더니 기분탓인지 뭔가 부담스럽게 크던 여드름들이 가라앉은느낌..? 그리고 여드름이 숙성이 될락 말락 하던것은 숙성이 됐더라고요! 터지고나서 빨갰던 여드름은 아물것같이 피부가 쪼그라들었구요.

스킨케어 풀체인지 해서 그렇구나 ~ 했는데
꾸준히 두달동안 써보니 가끔 호르몬이나 환경적인 요인으로 인해서만 여드름이 생기고요,,

아까워서 가끔 여드름 생겼을때나 생길거 같을때만 발라줬는데
그럴때 마다 여드름 성장이 진짜 멈춰요

거짓말안치고 여드름 완전 사라졌어요
이렇게 매끈한 제 마빡 정말 오랜만에 봐요ㅠㅠㅠㅠ
심지어 볼에 있던 멍같은 여드름 흉터도 사라졌어요..
어느날 거울을 봤는데 흉터가 옅어지는거 같은거에요
그래서 흉터에도 두껍게 발라줬거든요!
그랬더니 여드름 흉터도 .. 사라지는..... ㄹㅇ 스팟크림..
약국연고보다 낫다..!!

저도 구매 후에 SNS에서 광고로 이게 뜨는걸 봤었는데 SNS광고는 거르거든요..
그래서 SNS광고에 이게 뜨는게 좀 아쉽더라고요..
이미지 흐리는 느낌이라서ㅠㅠ

암튼 저는 다시 구매할거에요!
아쉬운점이 있다면 튜브 제질..ㅠ 싹싹 비워 쓰기 어려워욥 ㅠ","[2달 사용 후기]
리뷰 잘 안쓰는데 저는 정말 레전드 효과를 봐서 다시 사려고 들어왔다가 안좋은 리뷰가 넘 많아 리뷰남겨요

-구매동기
제가 성인이 되고 2-3년전부터 갑자기 학생때도 안나던 여드름이
생겨서 안없어지더니 완전히 피부가 여드름 피부로 바뀐거에요..

특히 이마에 괴물같이 가로로 쭈루룩 큰 여드름이 크고 딱딱하게 여러개 생겨서 화장으로 커버도 안되고..
약국에서 여드름 연고 종류별로 다 써 보았지만 하나 없어지면 없어질때쯤 옆에 하나올라오고 그러더라고요..?
게다가 양도 엄청 조금인데 가격은또 비싸서 부담스럽고,,
의료용 바늘로 짜보기도 했는데 깊게찔러서 흉진것도 있고
출근하면 사람들이 놀라면서 여드름이 점점 심해진다고 하는데
진짜 스트레스였어요ㅜㅜ

뭘해도 안없어 지길래 생각해낸게 3년전엔 피부가 막 좋은건 아니여도 여드름이 하나도 없었거든요. 그래서 그때 쓰던 스킨케어 제품으로 싹 풀체인지 해야겠다고 큰맘 먹고 올영 앱에 들어왔어요.

그때 아누아 어성초80 앰플을 주변에 추천하고 선물할 정도로 엄청 애정했어서 앰플을 구매하려고 아누아에 들어왔다가 스팟크림이 출시된걸보고 믿고 질렀어요

-리얼후기
1일차 사용후기.. 낮에도 발라도 되고, 밤엔 연고처럼 두껍게 발라주면 된다라고 써있었던거같아요(원래 설명서같은거 잘안봄)

그래서 낮에 택배오자마자 전체적으로 살살 발라주고, 밤에 자기전에 연고처럼 여드름에만 좀 두껍게 발라줬어요 아까워서 듬뿍은 자제했어요 항상
자고 일어났더니 기분탓인지 뭔가 부담스럽게 크던 여드름들이 가라앉은느낌..? 그리고 여드름이 숙성이 될락 말락 하던것은 숙성이 됐더라고요! 터지고나서 빨갰던 여드름은 아물것같이 피부가 쪼그라들었구요.

스킨케어 풀체인지 해서 그렇구나 ~ 했는데
꾸준히 두달동안 써보니 가끔 호르몬이나 환경적인 요인으로 인해서만 여드름이 생기고요,,

아까워서 가끔 여드름 생겼을때나 생길거 같을때만 발라줬는데
그럴때 마다 여드름 성장이 진짜 멈춰요

거짓말안치고 여드름 완전 사라졌어요
이렇게 매끈한 제 마빡 정말 오랜만에 봐요ㅠㅠㅠㅠ
심지어 볼에 있던 멍같은 여드름 흉터도 사라졌어요..
어느날 거울을 봤는데 흉터가 옅어지는거 같은거에요
그래서 흉터에도 두껍게 발라줬거든요!
그랬더니 여드름 흉터도 .. 사라지는..... ㄹㅇ 스팟크림..
약국연고보다 낫다..!!

저도 구매 후에 SNS에서 광고로 이게 뜨는걸 봤었는데 SNS광고는 거르거든요..
그래서 SNS광고에 이게 뜨는게 좀 아쉽더라고요..
이미지 흐리는 느낌이라서ㅠㅠ

암튼 저는 다시 구매할거에요!
아쉬운점이 있다면 튜브 제질..ㅠ 싹싹 비워 쓰기 어려워욥 ㅠ","2달 사용 후기 리뷰 잘 안쓰는데 저는 정말 레전드 효과를 봐서 다시 사려고 들어왔다가 안좋은 리뷰가 넘 많아 리뷰남겨요 -구매동기 제가 성인이 되고 2-3년전부터 갑자기 학생때도 안나던 여드름이 생겨서 안없어지더니 완전히 피부가 여드름 피부로 바뀐거에요. 특히 이마에 괴물같이 가로로 쭈루룩 큰 여드름이 크고 딱딱하게 여러개 생겨서 화장으로 커버도 안되고. 약국에서 여드름 연고 종류별로 다 써 보았지만 하나 없어지면 없어질때쯤 옆에 하나올라오고 그러더라고요 게다가 양도 엄청 조금인데 가격은또 비싸서 부담스럽고,, 의료용 바늘로 짜보기도 했는데 깊게찔러서 흉진것도 있고 출근하면 사람들이 놀라면서 여드름이 점점 심해진다고 하는데 진짜 스트레스였어요 뭘해도 안없어 지길래 생각해낸게 3년전엔 피부가 막 좋은건 아니여도 여드름이 하나도 없었거든요. 그래서 그때 쓰던 스킨케어 제품으로 싹 풀체인지 해야겠다고 큰맘 먹고 올영 앱에 들어왔어요. 그때 아누아 어성초80 앰플을 주변에 추천하고 선",1.0,498,0.7389558232931727
2025.08.31,4점,,,자극없이 순하고 발라봤는데 비약적으로 효과가 있지는 않으나 울긋불긋하게 올라오는 트러블들 개체수가 많이 줄어서 만족합니다.,자극없이 순하고 발라봤는데 비약적으로 효과가 있지는 않으나 울긋불긋하게 올라오는 트러블들 개체수가 많이 줄어서 만족합니다.,자극없이 순하고 발라봤는데 비약적으로 효과가 있지는 않으나 울긋불긋하게 올라오는 트러블들 개체수가 많이 줄어서 만족합니다.,1.0,68,0.7941176470588235
2025.08.31,5점,,,진정이 좀 되는 것 같은데 유분기가 있는 것 같아요. 일단 꾸준히 써보죠,진정이 좀 되는 것 같은데 유분기가 있는 것 같아요. 일단 꾸준히 써보죠,진정이 좀 되는 것 같은데 유분기가 있는 것 같아요. 일단 꾸준히 써보죠,1.0,40,0.7
2025.08.31,3점,,,얼굴에 연고바르는 느낌이고 그렇게 좋은지 모르겠어요 그냥 다른 크림 사세요,얼굴에 연고바르는 느낌이고 그렇게 좋은지 모르겠어요 그냥 다른 크림 사세요,얼굴에 연고바르는 느낌이고 그렇게 좋은지 모르겠어요 그냥 다른 크림 사세요,1.0,41,0.7804878048780488
2025.08.31,4점,,한달이상사용,처음에는 눈에 띄긴했는데 계속 쓰다보니까 좋은지는 잘 모르겠어요,처음에는 눈에 띄긴했는데 계속 쓰다보니까 좋은지는 잘 모르겠어요,처음에는 눈에 띄긴했는데 계속 쓰다보니까 좋은지는 잘 모르겠어요,1.0,35,0.8
2025.08.31,5점,,,한통을 다 비웠는데요 트러블에 도움되는거 같아요 흡수도 잘되는거 같아요,한통을 다 비웠는데요 트러블에 도움되는거 같아요 흡수도 잘되는거 같아요,한통을 다 비웠는데요 트러블에 도움되는거 같아요 흡수도 잘되는거 같아요,1.0,39,0.7948717948717948
2025.08.31,5점,"복합성, 봄웜톤, 잡티, 각질",,"아직 사용은 안해봤지만
다른 후기들이 너무 조아서
구매해봤어여
한달뒤에 다시 리뷰 남길게여 ㅎㅎ","아직 사용은 안해봤지만
다른 후기들이 너무 조아서
구매해봤어여
한달뒤에 다시 리뷰 남길게여 ㅎㅎ",아직 사용은 안해봤지만 다른 후기들이 너무 조아서 구매해봤어여 한달뒤에 다시 리뷰 남길게여,1.0,50,0.78
